{"$schema":"schemas/qualification-trial-receipt-authority-policy.schema.json","schema_version":"openadapt.qualification-trial-receipt-authority-policy/v1","repository":"OpenAdaptAI/openadapt-evals","repository_id":"1135998197","repository_owner_id":"132681217","workflow":".github/workflows/issue-qualification-trial-receipts.yml","ref":"refs/heads/main","trigger":"workflow_dispatch","input":{"name":"campaign_request_handle","schema_version":"openadapt.opaque-one-use-campaign-request-handle/v1","pattern":"^qcrh_[A-Za-z0-9_-]{43}$","atomically_consumed":true},"signing":{"algorithm":"ed25519","signer_registry_usage":"qualification-trial-receipt","distinct_key_per_receipt_type":true,"outer_sigstore_bundle":false},"authorities":[{"receipt_type":"runner","environment":"qualification-trial-runner","runner_labels":["self-hosted","evidence-authority","qualification-trial-runner"]},{"receipt_type":"observer","environment":"qualification-trial-observer","runner_labels":["self-hosted","evidence-authority","qualification-trial-observer"]},{"receipt_type":"delivery","environment":"qualification-trial-delivery","runner_labels":["self-hosted","evidence-authority","qualification-trial-delivery"]},{"receipt_type":"decision","environment":"qualification-trial-decision","runner_labels":["self-hosted","evidence-authority","qualification-trial-decision"]},{"receipt_type":"policy","environment":"qualification-trial-policy","runner_labels":["self-hosted","evidence-authority","qualification-trial-policy"]},{"receipt_type":"repair","environment":"qualification-trial-repair","runner_labels":["self-hosted","evidence-authority","qualification-trial-repair"]},{"receipt_type":"cleanup","environment":"qualification-trial-cleanup","runner_labels":["self-hosted","evidence-authority","qualification-trial-cleanup"]},{"receipt_type":"cleanup_absence","environment":"qualification-trial-cleanup-absence","runner_labels":["self-hosted","evidence-authority","qualification-trial-cleanup-absence"]}]}
